"3662172","https://contrataciondelestado.es/wps/poc?uri=deeplink:detalle_licitacion&idEvl=v2LsJqMlw3amq21uxhbaVQ%3D%3D",2019-10-04 09:49:26,"VIGENTE",2019-05-27,"Resuelta","A-18/19","Servicio de interpretación en lengua de signos para la comunidad universitaria con discapacidad auditiva de la Universidad Autónoma de Madrid",,"280190,92","140095,46","154105","79540000;","1","79540000","Servicios de interpretación",,,,,,,,,,,,,,,,,,,,,,,,,,,,,,,,,,,,,,,"Servicios",,"ES300 - Madrid","Madrid","40.40841191","-3.68760088","Rectorado de la Universidad Autónoma de Madrid",,"Q2818013A","U02300001",,"Organismo de Derecho público","28049","Abierto",,"Ordinaria","Electrónica",2019-06-25 15:00:00,,"2014/24/EU",,,,,,,"2","Cursos, seminarios y gestiones administrativas",,"4305","3913,64","79540000;","1","79540000","Servicios de interpretación",,,,,,,,,,,,,,,,,,,,,,,,,,,,,,,,,,,,,,,"ES300 - Madrid","Madrid","40.40841191","-3.68760088","Adjudicado",2019-08-28,"2",,,,"A-18/19",2019-10-01,,"SIGNAR SOC. COOP.","OTROS","F-81818437",,"0","0"
"4103023","https://contrataciondelestado.es/wps/poc?uri=deeplink:detalle_licitacion&idEvl=crX9K0PfwQZ7h85%2Fpmmsfw%3D%3D",2019-10-03 14:15:14,"VIGENTE",2019-10-03,"Resuelta","A-6/20","Servicio para la realización de controles médicos y pruebas diagnósticas dentro de la campaña de prevención de cáncer ginecológico dirigida al personal femenino que presta servicios en la Universidad Autónoma de Madrid",,"250578","125289","125289","85121200;","1","85121200","Servicios de médicos especialistas",,,,,,,,,,,,,,,,,,,,,,,,,,,,,,,,,,,,,,,"Servicios",,"ES300 - Madrid","Madrid","40.40841191","-3.68760088","Rectorado de la Universidad Autónoma de Madrid",,"Q2818013A","U02300001",,"Organismo de Derecho público","28049","Abierto",,"Ordinaria","Electrónica",2019-10-18 15:00:00,,,,,,,,,"Sin lotes","Servicio para la realización de controles médicos y pruebas diagnósticas dentro de la campaña de prevención de cáncer ginecológico dirigida al personal femenino que presta servicios en la Universidad Autónoma de Madrid","250578","125289","125289","85121200;","1","85121200","Servicios de médicos especialistas",,,,,,,,,,,,,,,,,,,,,,,,,,,,,,,,,,,,,,,"ES300 - Madrid","Madrid","40.40841191","-3.68760088","Adjudicado",2020-01-09,"4",,,,"A-6/20",2020-02-10,,"FICEME, S.L.","NIF","B81413130",,"0","0"
"3850566","https://contrataciondelestado.es/wps/poc?uri=deeplink:detalle_licitacion&idEvl=4OD565FjgduXQV0WE7lYPw%3D%3D",2019-10-02 09:50:05,"VIGENTE",2019-07-17,"Resuelta","Sa-20/19","Suministro e instalación de ocho fuentes de alimentación en corriente continua para un sistema de crecimiento de láminas delgadas por epitaxia de haces moleculares de la Universidad Autónoma de Madrid",,"12072","12072","14607,12","38000000;","1","38000000","Equipo de laboratorio, óptico y de precisión (excepto gafas)",,,,,,,,,,,,,,,,,,,,,,,,,,,,,,,,,,,,,,,"Suministros",,"ES300 - Madrid","Madrid","40.40841191","-3.68760088","Rectorado de la Universidad Autónoma de Madrid",,"Q2818013A","U02300001",,"Organismo de Derecho público","28049","Abierto simplificado",,"Ordinaria","Electrónica",2019-07-31 15:00:00,,,,"Sí","Programa ERC Starting Grant, contrato ID: 758885",,,,"Sin lotes","Suministro e instalación de ocho fuentes de alimentación en corriente continua para un sistema de crecimiento de láminas delgadas por epitaxia de haces moleculares de la Universidad Autónoma de Madrid","12072","14607,12","12072","38000000;","1","38000000","Equipo de laboratorio, óptico y de precisión (excepto gafas)",,,,,,,,,,,,,,,,,,,,,,,,,,,,,,,,,,,,,,,"ES300 - Madrid","Madrid","40.40841191","-3.68760088","Desierto",2019-09-20,"4",,,,,,,,,,,,
"3651949","https://contrataciondelestado.es/wps/poc?uri=deeplink:detalle_licitacion&idEvl=b%2F6W6yqMl6Uuf4aBO%2BvQlQ%3D%3D",2019-09-26 10:59:34,"VIGENTE",2019-05-30,"Resuelta","O-4/19","Obra de impermeabilización y reparación de la calle Francisco Tomás y Valiente (fase 1 Facultad de Ciencias) de la Universidad Autónoma de Madrid",,"327922,91","396786,72","396786,72","45233252;","1","45233252","Trabajos de pavimentación de calles",,,,,,,,,,,,,,,,,,,,,,,,,,,,,,,,,,,,,,,"Obras",,"ES300 - Madrid","Madrid","40.40841191","-3.68760088","Rectorado de la Universidad Autónoma de Madrid",,"Q2818013A","U02300001",,"Organismo de Derecho público","28049","Abierto",,"Ordinaria","Electrónica",2019-06-25 15:00:00,,,,,,,,,"Sin lotes","Obra de impermeabilización y reparación de la calle Francisco Tomás y Valiente (fase 1 Facultad de Ciencias) de la Universidad Autónoma de Madrid","327922,91","396786,72","396786,72","45233252;","1","45233252","Trabajos de pavimentación de calles",,,,,,,,,,,,,,,,,,,,,,,,,,,,,,,,,,,,,,,"ES300 - Madrid","Madrid","40.40841191","-3.68760088","Adjudicado",2019-07-31,"13",,,,"O-4/19",2019-09-13,,"PICUADRADO, S.L.","NIF","B87057253",,"274124,3","331690,4"
"3866015","https://contrataciondelestado.es/wps/poc?uri=deeplink:detalle_licitacion&idEvl=MIGWujPyBm17h85%2Fpmmsfw%3D%3D",2019-09-25 18:55:49,"VIGENTE",2019-07-19,"Resuelta","P-1/19","Autorización demanial para la ocupación de los espacios dependientes de la Universidad Autónoma de Madrid, para llevar a cabo el desarrollo y explotación económica de las actividades propias de librería, papelería, venta de material de oficina y productos promocionales de esta Universidad",,,"0","0",,"1",,,,,,,,,,,,,,,,,,,,,,,,,,,,,,,,,,,,,,,,,"Patrimonial",,"ES300 - Madrid","Madrid","40.40841191","-3.68760088","Rectorado de la Universidad Autónoma de Madrid",,"Q2818013A","U02300001",,"Organismo de Derecho público","28049","Abierto",,"Ordinaria","Electrónica",2019-08-19 14:00:00,,,,,,,,,"Sin lotes","Autorización demanial para la ocupación de los espacios dependientes de la Universidad Autónoma de Madrid, para llevar a cabo el desarrollo y explotación económica de las actividades propias de librería, papelería, venta de material de oficina y productos promocionales de esta Universidad",,"0","0",,"1",,,,,,,,,,,,,,,,,,,,,,,,,,,,,,,,,,,,,,,,,"ES300 - Madrid","Madrid","40.40841191","-3.68760088","Adjudicado",2019-09-18,"2",,,,"P-1/19",2019-09-24,,"S.A. DE DISTRIBUCIÓN, EDICIÓN Y LIBRERÍAS (DELSA)","NIF","A28057230",,"0","0"
"3765293","https://contrataciondelestado.es/wps/poc?uri=deeplink:detalle_licitacion&idEvl=rQ3Jeu7C83znSoTX3z%2F7wA%3D%3D",2019-09-18 14:49:59,"VIGENTE",2019-06-26,"Resuelta","O-5/19","Obras para la instalación de un ascensor en el módulo II de la Facultad de Formación del Profesorado y Educación (Lote 1) y de un ascensor en el módulo VI de la Facultad de Filosofía y Letras (Lote 2) de la Universidad Autónoma de Madrid",,"226152,62","226152,62","273644,67","45313100;","1","45313100","Instalación de ascensores",,,,,,,,,,,,,,,,,,,,,,,,,,,,,,,,,,,,,,,"Obras",,"ES300 - Madrid","Madrid","40.40841191","-3.68760088","Rectorado de la Universidad Autónoma de Madrid",,"Q2818013A","U02300001",,"Organismo de Derecho público","28049","Abierto",,"Ordinaria","Electrónica",2019-07-22 15:00:00,,,,,,,,,"1","Instalación de un ascensor en el Módulo II de la Facultad de Formación de Profesorado y Educación.",,"133519,63","110346,8","45313100;","1","45313100","Instalación de ascensores",,,,,,,,,,,,,,,,,,,,,,,,,,,,,,,,,,,,,,,"ES300 - Madrid","Madrid","40.40841191","-3.68760088","Adjudicado",2019-09-09,"2",,,,"O-5/19",2019-09-16,,"SRH Construcciones Civiles y Administrativas, S.A.","NIF","A81708893",,"76599,91","92685,89"
"3765293","https://contrataciondelestado.es/wps/poc?uri=deeplink:detalle_licitacion&idEvl=rQ3Jeu7C83znSoTX3z%2F7wA%3D%3D",2019-09-18 14:49:59,"VIGENTE",2019-06-26,"Resuelta","O-5/19","Obras para la instalación de un ascensor en el módulo II de la Facultad de Formación del Profesorado y Educación (Lote 1) y de un ascensor en el módulo VI de la Facultad de Filosofía y Letras (Lote 2) de la Universidad Autónoma de Madrid",,"226152,62","226152,62","273644,67","45313100;","1","45313100","Instalación de ascensores",,,,,,,,,,,,,,,,,,,,,,,,,,,,,,,,,,,,,,,"Obras",,"ES300 - Madrid","Madrid","40.40841191","-3.68760088","Rectorado de la Universidad Autónoma de Madrid",,"Q2818013A","U02300001",,"Organismo de Derecho público","28049","Abierto",,"Ordinaria","Electrónica",2019-07-22 15:00:00,,,,,,,,,"2","Instalación de un ascensor en el Módulo VI de la Facultad de Filosofía y Letras.",,"140125,04","115805,82","45313100;","1","45313100","Instalación de ascensores",,,,,,,,,,,,,,,,,,,,,,,,,,,,,,,,,,,,,,,"ES300 - Madrid","Madrid","40.40841191","-3.68760088","Adjudicado",2019-09-09,"2",,,,"O-5/19",2019-09-16,,"SRH Construcciones Civiles y Administrativas, S.A.","NIF","A81708893",,"78744,72","95281,11"
"3895173","https://contrataciondelestado.es/wps/poc?uri=deeplink:detalle_licitacion&idEvl=KfURupUlasCXQV0WE7lYPw%3D%3D",2019-09-13 10:05:52,"VIGENTE",2019-07-29,"Resuelta","Sa-22/19","Suministro e instalación de un espectrómetro para medir absorciones, emisiones en el estado estacionario y resueltas en tiempo, para el laboratorio 503 de la Facultad de Ciencias de la Universidad Autónoma de Madrid",,"31230","31230","37788,3","38433210;","1","38433210","Espectrómetros de emisión",,,,,,,,,,,,,,,,,,,,,,,,,,,,,,,,,,,,,,,"Suministros",,"ES300 - Madrid","Madrid","40.40841191","-3.68760088","Rectorado de la Universidad Autónoma de Madrid",,"Q2818013A","U02300001",,"Organismo de Derecho público","28049","Abierto simplificado",,"Ordinaria","Electrónica",2019-08-12 15:00:00,,,,,,,,,"Sin lotes","Suministro e instalación de un espectrómetro para medir absorciones, emisiones en el estado estacionario y resueltas en tiempo, para el laboratorio 503 de la Facultad de Ciencias de la Universidad Autónoma de Madrid","31230","37788,3","31230","38433210;","1","38433210","Espectrómetros de emisión",,,,,,,,,,,,,,,,,,,,,,,,,,,,,,,,,,,,,,,"ES300 - Madrid","Madrid","40.40841191","-3.68760088","Adjudicado",2019-09-09,"1",,,,"Sa-22/19",2019-09-12,2019-09-12,"Lasing, S.A.","NIF","A08480519",,"30985","37491,85"
"3760487","https://contrataciondelestado.es/wps/poc?uri=deeplink:detalle_licitacion&idEvl=K4n1bJ76cMWXQV0WE7lYPw%3D%3D",2019-09-03 08:25:08,"VIGENTE",2019-06-25,"Resuelta","S-16/19","Alquiler de solución que permita refrigerar tres armarios de computación y uno de comunicaciones mediante la creación de un pasillo frío, en una sala del Centro de Computación Científica de la Universidad Autónoma de Madrid (CCC-UAM)",,"34710,74","17355,37","21000","42512000;","1","42512000","Instalaciones de aire acondicionado",,,,,,,,,,,,,,,,,,,,,,,,,,,,,,,,,,,,,,,"Suministros",,"ES300 - Madrid","Madrid","40.40841191","-3.68760088","Rectorado de la Universidad Autónoma de Madrid",,"Q2818013A","U02300001",,"Organismo de Derecho público","28049","Abierto",,"Ordinaria","Electrónica",2019-07-10 15:00:00,,,,,,,,,"Sin lotes","Alquiler de solución que permita refrigerar tres armarios de computación y uno de comunicaciones mediante la creación de un pasillo frío, en una sala del Centro de Computación Científica de la Universidad Autónoma de Madrid (CCC-UAM)","34710,74","21000","17355,37","42512000;","1","42512000","Instalaciones de aire acondicionado",,,,,,,,,,,,,,,,,,,,,,,,,,,,,,,,,,,,,,,"ES300 - Madrid","Madrid","40.40841191","-3.68760088","Adjudicado",2019-07-31,"1",,,,"S-16/19",2019-08-02,2019-08-03,"AGGREKO IBERIA","NIF","A62737291",,"17000","20570"
"3272266","https://contrataciondelestado.es/wps/poc?uri=deeplink:detalle_licitacion&idEvl=AUGptddcGzeiEJrVRqloyA%3D%3D",2019-08-05 09:41:10,"VIGENTE",2019-03-13,"Resuelta","S-7/19","Arrendamiento, con opción a compra, de ordenadores personales destinados a la docencia y administración en la Universidad Autónoma de Madrid",,"1280778,33","1254640","1518114,4","30200000;","1","30200000","Equipo y material informático",,,,,,,,,,,,,,,,,,,,,,,,,,,,,,,,,,,,,,,"Suministros",,"ES300 - Madrid","Madrid","40.40841191","-3.68760088","Rectorado de la Universidad Autónoma de Madrid",,"Q2818013A","U02300001",,"Organismo de Derecho público","28049","Abierto",,"Ordinaria","Electrónica",2019-04-11 15:00:00,,"2014/24/EU",,,,,,,"1","Quinientos treinta y ocho (538) ordenadores personales desktop Tipo I destinados a Aulas de Informática y puestos de trabajo de administración",,"395795,84","327104","30200000;","1","30200000","Equipo y material informático",,,,,,,,,,,,,,,,,,,,,,,,,,,,,,,,,,,,,,,"ES300 - Madrid","Madrid","40.40841191","-3.68760088","Adjudicado",2019-05-29,"5",,,,"S-7/19 (Lote 1)",2019-06-25,2019-06-26,"DISINFOR,S.L.","NIF","B78949799",,"261102,16","315933,61"
"3272266","https://contrataciondelestado.es/wps/poc?uri=deeplink:detalle_licitacion&idEvl=AUGptddcGzeiEJrVRqloyA%3D%3D",2019-08-05 09:41:10,"VIGENTE",2019-03-13,"Resuelta","S-7/19","Arrendamiento, con opción a compra, de ordenadores personales destinados a la docencia y administración en la Universidad Autónoma de Madrid",,"1280778,33","1254640","1518114,4","30200000;","1","30200000","Equipo y material informático",,,,,,,,,,,,,,,,,,,,,,,,,,,,,,,,,,,,,,,"Suministros",,"ES300 - Madrid","Madrid","40.40841191","-3.68760088","Rectorado de la Universidad Autónoma de Madrid",,"Q2818013A","U02300001",,"Organismo de Derecho público","28049","Abierto",,"Ordinaria","Electrónica",2019-04-11 15:00:00,,"2014/24/EU",,,,,,,"2","Trescientos treinta y ocho (338) ordenadores personales desktop Tipo II, destinados a Laboratorios Docentes de la Escuela Politécnica Superior (EPS)",,"266654,96","220376","30200000;","1","30200000","Equipo y material informático",,,,,,,,,,,,,,,,,,,,,,,,,,,,,,,,,,,,,,,"ES300 - Madrid","Madrid","40.40841191","-3.68760088","Adjudicado",2019-05-29,"5",,,,"S-7/19 (Lote 2)",2019-06-25,2019-06-26,"DISINFOR,S.L.","NIF","B78949799",,"169838,24","205504,27"
"3272266","https://contrataciondelestado.es/wps/poc?uri=deeplink:detalle_licitacion&idEvl=AUGptddcGzeiEJrVRqloyA%3D%3D",2019-08-05 09:41:10,"VIGENTE",2019-03-13,"Resuelta","S-7/19","Arrendamiento, con opción a compra, de ordenadores personales destinados a la docencia y administración en la Universidad Autónoma de Madrid",,"1280778,33","1254640","1518114,4","30200000;","1","30200000","Equipo y material informático",,,,,,,,,,,,,,,,,,,,,,,,,,,,,,,,,,,,,,,"Suministros",,"ES300 - Madrid","Madrid","40.40841191","-3.68760088","Rectorado de la Universidad Autónoma de Madrid",,"Q2818013A","U02300001",,"Organismo de Derecho público","28049","Abierto",,"Ordinaria","Electrónica",2019-04-11 15:00:00,,"2014/24/EU",,,,,,,"3","996 ordenadores personales portátiles destinados a PDl, puestos de trabajo que precisen movilidad y a Laboratorios Docentes de la Facultad de Medicina

",,"855663,6","707160","30200000;","1","30200000","Equipo y material informático",,,,,,,,,,,,,,,,,,,,,,,,,,,,,,,,,,,,,,,"ES300 - Madrid","Madrid","40.40841191","-3.68760088","Adjudicado",2019-06-13,"4",,,,"S-7/19",2019-07-31,2019-08-01,"DEUSTO SISTEMAS S.A.","NIF","A95191300",,"571590,06","691623,97"
"3470150","https://contrataciondelestado.es/wps/poc?uri=deeplink:detalle_licitacion&idEvl=W%2BvMWBwJakguf4aBO%2BvQlQ%3D%3D",2019-08-05 09:13:33,"VIGENTE",2019-04-10,"Resuelta","C-1/19","Concesión de servicios para la gestión y explotación de las instalaciones deportivas del campus de la Universidad Autónoma de Madrid",,"5379581,37","2700000","3267000","92610000;","1","92610000","Servicios de explotación de instalaciones deportivas",,,,,,,,,,,,,,,,,,,,,,,,,,,,,,,,,,,,,,,"Concesión de Servicios",,"ES300 - Madrid","Madrid","40.40841191","-3.68760088","Rectorado de la Universidad Autónoma de Madrid",,"Q2818013A","U02300001",,"Organismo de Derecho público","28049","Restringido",,"Ordinaria","Electrónica",2019-05-24 15:00:00,,,,,,,,,"Sin lotes","Concesión de servicios para la gestión y explotación de las instalaciones deportivas del campus de la Universidad Autónoma de Madrid","5379581,37","3267000","2700000","92610000;","1","92610000","Servicios de explotación de instalaciones deportivas",,,,,,,,,,,,,,,,,,,,,,,,,,,,,,,,,,,,,,,"ES300 - Madrid","Madrid","40.40841191","-3.68760088","Adjudicado",2019-07-04,"3",,,,"C-1/19",2019-07-31,2019-08-01,"Empresa Tecnica de Gestión Deportiva EMTESPORT S.L.","NIF","B48486161",,"2481552","3002677,92"
"3577090","https://contrataciondelestado.es/wps/poc?uri=deeplink:detalle_licitacion&idEvl=0NiFU%2F1U8mjnSoTX3z%2F7wA%3D%3D",2019-07-31 17:42:48,"VIGENTE",2019-05-09,"Resuelta","S-12/19","Contratación del derecho de uso de licencias modalidad Campus para la Universidad Autónoma de Madrid",,"627153,6","758855,86","758855,86","48000000;","1","48000000","Paquetes de software y sistemas de información",,,,,,,,,,,,,,,,,,,,,,,,,,,,,,,,,,,,,,,"Suministros",,"ES300 - Madrid","Madrid","40.40841191","-3.68760088","Rectorado de la Universidad Autónoma de Madrid",,"Q2818013A","U02300001",,"Organismo de Derecho público","28049","Abierto",,"Ordinaria","Electrónica",2019-06-07 15:00:00,,"2014/24/EU",,,,,,,"1","Derecho de despliegue ilimitado de productos Oracle",,"205700","170000","48000000;","1","48000000","Paquetes de software y sistemas de información",,,,,,,,,,,,,,,,,,,,,,,,,,,,,,,,,,,,,,,"ES300 - Madrid","Madrid","40.40841191","-3.68760088","Adjudicado",2019-06-28,"1",,,,"S-12/19",2019-07-25,2019-07-26,"UNIVERSITAS XXI, SOLUCIONES Y TECNOLOGÍA PARA LA UNIVERSIDAD S.A.","NIF","A80897770",,"160735,5","194489,96"
"3577090","https://contrataciondelestado.es/wps/poc?uri=deeplink:detalle_licitacion&idEvl=0NiFU%2F1U8mjnSoTX3z%2F7wA%3D%3D",2019-07-31 17:42:48,"VIGENTE",2019-05-09,"Resuelta","S-12/19","Contratación del derecho de uso de licencias modalidad Campus para la Universidad Autónoma de Madrid",,"627153,6","758855,86","758855,86","48000000;","1","48000000","Paquetes de software y sistemas de información",,,,,,,,,,,,,,,,,,,,,,,,,,,,,,,,,,,,,,,"Suministros",,"ES300 - Madrid","Madrid","40.40841191","-3.68760088","Rectorado de la Universidad Autónoma de Madrid",,"Q2818013A","U02300001",,"Organismo de Derecho público","28049","Abierto",,"Ordinaria","Electrónica",2019-06-07 15:00:00,,"2014/24/EU",,,,,,,"2","Arrendamiento de licencias de productos Microsoft",,"553155,86","457153,6","48000000;","1","48000000","Paquetes de software y sistemas de información",,,,,,,,,,,,,,,,,,,,,,,,,,,,,,,,,,,,,,,"ES300 - Madrid","Madrid","40.40841191","-3.68760088","Adjudicado",2019-06-28,"3",,,,"S-12/19",2019-07-25,2019-07-26,"Fujitsu Technology Solutions","NIF","A28472819",,"407209,41","492723,39"
"3739845","https://contrataciondelestado.es/wps/poc?uri=deeplink:detalle_licitacion&idEvl=1QRLMYHXG6Smq21uxhbaVQ%3D%3D",2019-07-26 16:59:27,"VIGENTE",2019-06-20,"Resuelta","Sa-15/19","Suministro de un (1) servidor rack 4U de tarjetas gráficas o GPUs (graphics processing units) y tres (3) servidores de escritorio con GPUs integradas, cuyas características se especifican en el Pliego de Prescripciones Técnicas",,"33282,64","40271,99","40271,99","48822000;","1","48822000","Servidores de ordenador",,,,,,,,,,,,,,,,,,,,,,,,,,,,,,,,,,,,,,,"Suministros",,"ES300 - Madrid","Madrid","40.40841191","-3.68760088","Rectorado de la Universidad Autónoma de Madrid",,"Q2818013A","U02300001",,"Organismo de Derecho público","28049","Abierto simplificado",,"Ordinaria","Electrónica",2019-07-04 15:00:00,,,,,,,,,"1","Un (1) servidor rack 4U formado por 8 GPUs del tipo RTX 2080 y 2 CPUs (central processing unit) Intel Xeon Silver 4114 de 10 núcleos cada una. Una (1) licencia del software Amber18",,"24884,42","20565,64","48822000;","1","48822000","Servidores de ordenador",,,,,,,,,,,,,,,,,,,,,,,,,,,,,,,,,,,,,,,"ES300 - Madrid","Madrid","40.40841191","-3.68760088","Adjudicado",2019-07-15,"1",,,,"Sa-15/19",2019-07-24,2019-07-24,"LINUXVIXION","NIF","B83226399",,"20154,33","24386,74"
"3739845","https://contrataciondelestado.es/wps/poc?uri=deeplink:detalle_licitacion&idEvl=1QRLMYHXG6Smq21uxhbaVQ%3D%3D",2019-07-26 16:59:27,"VIGENTE",2019-06-20,"Resuelta","Sa-15/19","Suministro de un (1) servidor rack 4U de tarjetas gráficas o GPUs (graphics processing units) y tres (3) servidores de escritorio con GPUs integradas, cuyas características se especifican en el Pliego de Prescripciones Técnicas",,"33282,64","40271,99","40271,99","48822000;","1","48822000","Servidores de ordenador",,,,,,,,,,,,,,,,,,,,,,,,,,,,,,,,,,,,,,,"Suministros",,"ES300 - Madrid","Madrid","40.40841191","-3.68760088","Rectorado de la Universidad Autónoma de Madrid",,"Q2818013A","U02300001",,"Organismo de Derecho público","28049","Abierto simplificado",,"Ordinaria","Electrónica",2019-07-04 15:00:00,,,,,,,,,"2","Tres (3) servidores de escritorio con procesador Intel Core i7-7280X de 8 núcleos y 2 GPUs integradas de tipo RTX 2080",,"15387,57","12717","48822000;","1","48822000","Servidores de ordenador",,,,,,,,,,,,,,,,,,,,,,,,,,,,,,,,,,,,,,,"ES300 - Madrid","Madrid","40.40841191","-3.68760088","Adjudicado",2019-07-15,"2",,,,"Sa-15/19",2019-07-24,2019-07-24,"LINUXVIXION","NIF","B83226399",,"12462,66","15079,82"
"3597521","https://contrataciondelestado.es/wps/poc?uri=deeplink:detalle_licitacion&idEvl=SjhtvQPRhk97h85%2Fpmmsfw%3D%3D",2019-07-23 11:55:54,"VIGENTE",2019-05-17,"Resuelta","O-3/19","Obras de reforma de los locales de la planta baja (Lote 1) y de la “Sala B” de la cuarta entreplanta (Lote 2) del edificio Rectorado de la Universidad Autónoma de Madrid",,"282096,73","341337,04","341337,04","45262700;","1","45262700","Trabajos de transformación de edificios",,,,,,,,,,,,,,,,,,,,,,,,,,,,,,,,,,,,,,,"Obras",,"ES300 - Madrid","Madrid","40.40841191","-3.68760088","Rectorado de la Universidad Autónoma de Madrid",,"Q2818013A","U02300001",,"Organismo de Derecho público","28049","Abierto",,"Ordinaria","Electrónica",2019-06-11 15:00:00,,,,,,,,,"1","Reforma del local de la planta baja edificio Rectorado",,"248508,42","205378,86","45262700;","1","45262700","Trabajos de transformación de edificios",,,,,,,,,,,,,,,,,,,,,,,,,,,,,,,,,,,,,,,"ES300 - Madrid","Madrid","40.40841191","-3.68760088","Adjudicado",2019-07-17,"12",,,,"O-3/19",2019-07-22,,"KEVISCO, S.L.","NIF","B82150624",,"147379,88","178329,65"
"3597521","https://contrataciondelestado.es/wps/poc?uri=deeplink:detalle_licitacion&idEvl=SjhtvQPRhk97h85%2Fpmmsfw%3D%3D",2019-07-23 11:55:54,"VIGENTE",2019-05-17,"Resuelta","O-3/19","Obras de reforma de los locales de la planta baja (Lote 1) y de la “Sala B” de la cuarta entreplanta (Lote 2) del edificio Rectorado de la Universidad Autónoma de Madrid",,"282096,73","341337,04","341337,04","45262700;","1","45262700","Trabajos de transformación de edificios",,,,,,,,,,,,,,,,,,,,,,,,,,,,,,,,,,,,,,,"Obras",,"ES300 - Madrid","Madrid","40.40841191","-3.68760088","Rectorado de la Universidad Autónoma de Madrid",,"Q2818013A","U02300001",,"Organismo de Derecho público","28049","Abierto",,"Ordinaria","Electrónica",2019-06-11 15:00:00,,,,,,,,,"2","Reforma de la ""Sala B"" de la cuarta entreplanta edificio Rectorado.",,"92828,62","76717,87","45262700;","1","45262700","Trabajos de transformación de edificios",,,,,,,,,,,,,,,,,,,,,,,,,,,,,,,,,,,,,,,"ES300 - Madrid","Madrid","40.40841191","-3.68760088","Adjudicado",2019-07-17,"10",,,,"O-3/19",2019-07-22,,"KEVISCO, S.L.","NIF","B82150624",,"59494,71","71988,6"
"2923521","https://contrataciondelestado.es/wps/poc?uri=deeplink:detalle_licitacion&idEvl=TJtgLVz%2BYNNvYnTkQN0%2FZA%3D%3D",2019-07-04 09:08:40,"VIGENTE",2019-01-30,"Resuelta","A-11/19","Servicio de mantenimiento de la jardinería y limpieza de exteriores en las zonas dependientes de la Universidad Autónoma de Madrid",,"2671200","1335600","1586692,8","90610000;77310000;","2","90610000","Servicios de limpieza y barrido de calles","77310000","Servicios de plantación y mantenimiento de zonas verdes",,,,,,,,,,,,,,,,,,,,,,,,,,,,,,,,,,,,,"Servicios",,"ES300 - Madrid","Madrid","40.40841191","-3.68760088","Rectorado de la Universidad Autónoma de Madrid",,"Q2818013A","U02300001",,"Organismo de Derecho público","28049","Abierto",,"Ordinaria","Electrónica",2019-03-01 15:00:00,,"2014/24/EU",,,,,,,"Sin lotes","Servicio de mantenimiento de la jardinería y limpieza de exteriores en las zonas dependientes de la Universidad Autónoma de Madrid","2671200","1586692,8","1335600","90610000;77310000;","2","90610000","Servicios de limpieza y barrido de calles","77310000","Servicios de plantación y mantenimiento de zonas verdes",,,,,,,,,,,,,,,,,,,,,,,,,,,,,,,,,,,,,"ES300 - Madrid","Madrid","40.40841191","-3.68760088","Adjudicado",2019-05-28,"8",,,,"A-11/19",2019-07-01,,"VALORIZA SERVICIOS MEDIOAMBIENTALES, S.A.","NIF","A28760692",,"1087134,17","1291515,39"
"3687380","https://contrataciondelestado.es/wps/poc?uri=deeplink:detalle_licitacion&idEvl=Su3la0tR%2FEerz3GQd5r6SQ%3D%3D",2019-07-03 12:07:16,"VIGENTE",2019-06-06,"Resuelta","Aa-19/19","Prestación del servicio para realizar análisis bromatológicos de alimentos e informes técnico-sanitarios de los comedores y cafeterías, así como de las aguas de consumo y de las piscinas, cubierta y descubierta, de la Universidad Autónoma de Madrid",,"22314,05","27000","27000","71900000;","1","71900000","Servicios de laboratorio",,,,,,,,,,,,,,,,,,,,,,,,,,,,,,,,,,,,,,,"Servicios",,"ES300 - Madrid","Madrid","40.40841191","-3.68760088","Rectorado de la Universidad Autónoma de Madrid",,"Q2818013A","U02300001",,"Organismo de Derecho público","28049","Abierto simplificado",,"Ordinaria","Electrónica",2019-06-20 15:00:00,,,,,,,,,"Sin lotes","Prestación del servicio para realizar análisis bromatológicos de alimentos e informes técnico-sanitarios de los comedores y cafeterías, así como de las aguas de consumo y de las piscinas, cubierta y descubierta, de la Universidad Autónoma de Madrid","22314,05","27000","27000","71900000;","1","71900000","Servicios de laboratorio",,,,,,,,,,,,,,,,,,,,,,,,,,,,,,,,,,,,,,,"ES300 - Madrid","Madrid","40.40841191","-3.68760088","Adjudicado",2019-06-28,"2",,,,"Aa-19/19",2019-07-01,2019-07-01,"AQUIMISA, S.L.","NIF","B37289923",,"20975,2","25380"
