"3623722","https://contrataciondelestado.es/wps/poc?uri=deeplink:detalle_licitacion&idEvl=FgW0d5yCj%2BcBPRBxZ4nJ%2Fg%3D%3D",2019-06-28 13:32:30,"VIGENTE",2019-05-23,"Resuelta","Sa-14/19","Suministro e instalación de un Cromatógrafo de líquidos de alta resolución (HPLC-DAD), en el laboratorio 102, planta baja, módulo VI de la Facultad de Ciencias",,"32300","39083","39083","38432200;","1","38432200","Cromatógrafos",,,,,,,,,,,,,,,,,,,,,,,,,,,,,,,,,,,,,,,"Suministros",,"ES300 - Madrid","Madrid","40.40841191","-3.68760088","Rectorado de la Universidad Autónoma de Madrid",,"Q2818013A","U02300001",,"Organismo de Derecho público","28049","Abierto simplificado",,"Ordinaria","Electrónica",2019-06-06 15:00:00,,,,,,,,,"Sin lotes","Suministro e instalación de un Cromatógrafo de líquidos de alta resolución (HPLC-DAD), en el laboratorio 102, planta baja, módulo VI de la Facultad de Ciencias","32300","39083","39083","38432200;","1","38432200","Cromatógrafos",,,,,,,,,,,,,,,,,,,,,,,,,,,,,,,,,,,,,,,"ES300 - Madrid","Madrid","40.40841191","-3.68760088","Adjudicado",2019-06-19,"2",,,,"Sa-14/19",2019-06-27,2019-06-27,"Izasa Scientific S.L.U.","NIF","B66350281",,"32300","39083"
"3618113","https://contrataciondelestado.es/wps/poc?uri=deeplink:detalle_licitacion&idEvl=Qr2IzUTybSt7h85%2Fpmmsfw%3D%3D",2019-06-28 13:29:52,"VIGENTE",2019-05-22,"Resuelta","Sa-13/19","Suministro e instalación de un Cromatógrafo de gases de alta sensibilidad (Detector de Plasma), laboratorio 101, primera planta, módulo VI de la Facultad de Ciencias de la Universidad Autónoma de Madrid",,"22600","27346","27346","38432210;","1","38432210","Cromatógrafos de gas",,,,,,,,,,,,,,,,,,,,,,,,,,,,,,,,,,,,,,,"Suministros",,"ES300 - Madrid","Madrid","40.40841191","-3.68760088","Rectorado de la Universidad Autónoma de Madrid",,"Q2818013A","U02300001",,"Organismo de Derecho público","28049","Abierto simplificado",,"Ordinaria","Electrónica",2019-06-05 15:00:00,,,,,,,,,"Sin lotes","Suministro e instalación de un Cromatógrafo de gases de alta sensibilidad (Detector de Plasma), laboratorio 101, primera planta, módulo VI de la Facultad de Ciencias de la Universidad Autónoma de Madrid","22600","27346","27346","38432210;","1","38432210","Cromatógrafos de gas",,,,,,,,,,,,,,,,,,,,,,,,,,,,,,,,,,,,,,,"ES300 - Madrid","Madrid","40.40841191","-3.68760088","Adjudicado",2019-06-19,"1",,,,"Sa-13/19",2019-06-27,2019-06-27,"Izasa Scientific S.L.U.","NIF","B66350281",,"22600","27346"
"3340885","https://contrataciondelestado.es/wps/poc?uri=deeplink:detalle_licitacion&idEvl=CH3dYvF%2Bui4BPRBxZ4nJ%2Fg%3D%3D",2019-06-24 09:08:01,"VIGENTE",2019-03-14,"Resuelta","A-12/19","Servicios para el rediseño de la página institucional, www.uam.es, soportada por la plataforma Oracle WebCenter Sites, no incluyéndose en el presente contrato ni los sites de las distintas Facultades ni el de la Escuela Politécnica Superior",,"290000","290000","350900","72000000;","1","72000000","Servicios TI: consultoría, desarrollo de software, Internet y apoyo",,,,,,,,,,,,,,,,,,,,,,,,,,,,,,,,,,,,,,,"Servicios",,"ES300 - Madrid","Madrid","40.40841191","-3.68760088","Rectorado de la Universidad Autónoma de Madrid",,"Q2818013A","U02300001",,"Organismo de Derecho público","28049","Abierto",,"Ordinaria","Electrónica",2019-04-15 15:00:00,,"2014/24/EU",,,,,,,"Sin lotes","Servicios para el rediseño de la página institucional, www.uam.es, soportada por la plataforma Oracle WebCenter Sites, no incluyéndose en el presente contrato ni los sites de las distintas Facultades ni el de la Escuela Politécnica Superior","290000","350900","290000","72000000;","1","72000000","Servicios TI: consultoría, desarrollo de software, Internet y apoyo",,,,,,,,,,,,,,,,,,,,,,,,,,,,,,,,,,,,,,,"ES300 - Madrid","Madrid","40.40841191","-3.68760088","Adjudicado",2019-05-22,"1",,,,"A-12/19",2019-06-13,,"Altia Consultores SA","NIF","A15456585",,"217210","262824,1"
"3462203","https://contrataciondelestado.es/wps/poc?uri=deeplink:detalle_licitacion&idEvl=8NiiingSsMwBPRBxZ4nJ%2Fg%3D%3D",2019-06-14 08:48:40,"VIGENTE",2019-04-12,"Resuelta","A-16/19","Servicios de asesoría jurídica en sede administrativa y de representación y defensa procesal ante la Jurisdicción Social en relación con los procedimientos de oficio iniciados o que puedan iniciarse por comunicaciones de la autoridad laboral por acta de infracción o de liquidación levantada por la Inspección de Trabajo y de Seguridad Social en los expedientes con número: 282017008200755; 282018000353434; 282018000357777; y 282018008156577, relativos a las materias de Seguridad Social y extranjeros y sobre estudiantes del programa de prácticas remuneradas de la Oficina de Prácticas Externas y Empleabilidad de la Universidad, hasta su resolución final mediante sentencia firme, incluidos los posibles recursos de casación para unificación de doctrina ante el Tribunal Supremo, todo ello de conformidad con el artículo 129.2 de los Estatutos de la Universidad Autónoma de Madrid",,"90000","90000","108000","79110000;","1","79110000","Servicios de asesoría y representación jurídicas",,,,,,,,,,,,,,,,,,,,,,,,,,,,,,,,,,,,,,,"Servicios",,"ES300 - Madrid","Madrid","40.40841191","-3.68760088","Rectorado de la Universidad Autónoma de Madrid",,"Q2818013A","U02300001",,"Organismo de Derecho público","28049","Abierto",,"Ordinaria","Electrónica",2019-05-16 15:00:00,,,,,,,,,"Sin lotes","Servicios de asesoría jurídica en sede administrativa y de representación y defensa procesal ante la Jurisdicción Social en relación con los procedimientos de oficio iniciados o que puedan iniciarse por comunicaciones de la autoridad laboral por acta de infracción o de liquidación levantada por la Inspección de Trabajo y de Seguridad Social en los expedientes con número: 282017008200755; 282018000353434; 282018000357777; y 282018008156577, relativos a las materias de Seguridad Social y extranjeros y sobre estudiantes del programa de prácticas remuneradas de la Oficina de Prácticas Externas y Empleabilidad de la Universidad, hasta su resolución final mediante sentencia firme, incluidos los posibles recursos de casación para unificación de doctrina ante el Tribunal Supremo, todo ello de conformidad con el artículo 129.2 de los Estatutos de la Universidad Autónoma de Madrid","90000","108000","90000","79110000;","1","79110000","Servicios de asesoría y representación jurídicas",,,,,,,,,,,,,,,,,,,,,,,,,,,,,,,,,,,,,,,"ES300 - Madrid","Madrid","40.40841191","-3.68760088","Adjudicado",2019-06-11,"4",,,,"A-16/19",2019-06-13,,"SAGARDOY ABOGADOS, S.L.P.","NIF","B82874199",,"70000","84700"
"3418936","https://contrataciondelestado.es/wps/poc?uri=deeplink:detalle_licitacion&idEvl=TdqEF%2FtwX7Euf4aBO%2BvQlQ%3D%3D",2019-06-10 12:43:14,"VIGENTE",2019-04-05,"Resuelta","S-9/19","Suministro de licencias Exadata para la Universidad Autónoma de Madrid",,"131430,6","131430,6","159031,03","72267100;","1","72267100","Mantenimiento de software de tecnología de la información",,,,,,,,,,,,,,,,,,,,,,,,,,,,,,,,,,,,,,,"Suministros",,"ES300 - Madrid","Madrid","40.40841191","-3.68760088","Rectorado de la Universidad Autónoma de Madrid",,"Q2818013A","U02300001",,"Organismo de Derecho público","28049","Abierto",,"Ordinaria","Electrónica",2019-04-24 15:00:00,,,,,,,,,"Sin lotes","Suministro de licencias Exadata para la Universidad Autónoma de Madrid","131430,6","159031,03","131430,6","72267100;","1","72267100","Mantenimiento de software de tecnología de la información",,,,,,,,,,,,,,,,,,,,,,,,,,,,,,,,,,,,,,,"ES300 - Madrid","Madrid","40.40841191","-3.68760088","Adjudicado",2019-05-10,"1",,,,"S-9/19",2019-06-07,2019-06-07,"Servicios y Productos Informáticos, S.A.","NIF","A48109144",,"124999","151248,79"
"3303507","https://contrataciondelestado.es/wps/poc?uri=deeplink:detalle_licitacion&idEvl=i7DKw92G5JcBPRBxZ4nJ%2Fg%3D%3D",2019-06-04 10:08:42,"VIGENTE",2019-03-11,"Resuelta","O-2/19","Reforma de los Archivos de la Planta Semisótano del Edificio de la Facultad de Ciencias de la Universidad Autónoma de Madrid",,"135214,77","135214,77","163609,88","45262700;","1","45262700","Trabajos de transformación de edificios",,,,,,,,,,,,,,,,,,,,,,,,,,,,,,,,,,,,,,,"Obras",,"ES300 - Madrid","Madrid","40.40841191","-3.68760088","Rectorado de la Universidad Autónoma de Madrid",,"Q2818013A","U02300001",,"Organismo de Derecho público","28049","Abierto",,"Ordinaria","Electrónica",2019-04-08 15:00:00,,,,,,,,,"Sin lotes","Reforma de los Archivos de la Planta Semisótano del Edificio de la Facultad de Ciencias de la Universidad Autónoma de Madrid","135214,77","163609,88","135214,77","45262700;","1","45262700","Trabajos de transformación de edificios",,,,,,,,,,,,,,,,,,,,,,,,,,,,,,,,,,,,,,,"ES300 - Madrid","Madrid","40.40841191","-3.68760088","Adjudicado",2019-05-24,"21",,,,"O-2/19",2019-05-30,,"Ramón y Conchi, S.A.","NIF","A28970614",,"95055,99","115017,75"
"3592281","https://contrataciondelestado.es/wps/poc?uri=deeplink:detalle_licitacion&idEvl=fCyIMpCZZbOiEJrVRqloyA%3D%3D",2019-06-04 09:45:55,"VIGENTE",2019-05-16,"Resuelta","Aa-17/19","Prestación de servicios para la realización de análisis bromatológicos de alimentos e informes técnico-sanitarios de los comedores y cafeterías, así como de las aguas de consumo y de las piscinas, cubierta y descubierta, de la Universidad Autónoma de Madrid",,"22314,05","27000","27000","71900000;","1","71900000","Servicios de laboratorio",,,,,,,,,,,,,,,,,,,,,,,,,,,,,,,,,,,,,,,"Servicios",,"ES300 - Madrid","Madrid","40.40841191","-3.68760088","Rectorado de la Universidad Autónoma de Madrid",,"Q2818013A","U02300001",,"Organismo de Derecho público","28049","Abierto simplificado",,"Ordinaria","Electrónica",2019-05-30 15:00:00,,,,,,,,,"Sin lotes","Prestación de servicios para la realización de análisis bromatológicos de alimentos e informes técnico-sanitarios de los comedores y cafeterías, así como de las aguas de consumo y de las piscinas, cubierta y descubierta, de la Universidad Autónoma de Madrid","22314,05","27000","27000","71900000;","1","71900000","Servicios de laboratorio",,,,,,,,,,,,,,,,,,,,,,,,,,,,,,,,,,,,,,,"ES300 - Madrid","Madrid","40.40841191","-3.68760088","Desierto",2019-06-03,"1",,,,,,,,,,,,
"3439773","https://contrataciondelestado.es/wps/poc?uri=deeplink:detalle_licitacion&idEvl=IjJ4aY253Ft7h85%2Fpmmsfw%3D%3D",2019-06-04 09:14:59,"VIGENTE",2019-04-10,"Resuelta","Aa-15/19","Mantenimiento del equipamiento de climatización freecooling y del software de control, del Centro de Procesos de Datos (CPD) de Tecnologías de la Información de la Universidad Autónoma de Madrid",,"29136","29136","35254,56","42512300;","1","42512300","Unidades de climatización",,,,,,,,,,,,,,,,,,,,,,,,,,,,,,,,,,,,,,,"Servicios",,"ES300 - Madrid","Madrid","40.40841191","-3.68760088","Rectorado de la Universidad Autónoma de Madrid",,"Q2818013A","U02300001",,"Organismo de Derecho público","28049","Abierto simplificado",,"Ordinaria","Electrónica",2019-04-26 15:00:00,,,,,,,,,"Sin lotes","Mantenimiento del equipamiento de climatización freecooling y del software de control, del Centro de Procesos de Datos (CPD) de Tecnologías de la Información de la Universidad Autónoma de Madrid","29136","35254,56","29136","42512300;","1","42512300","Unidades de climatización",,,,,,,,,,,,,,,,,,,,,,,,,,,,,,,,,,,,,,,"ES300 - Madrid","Madrid","40.40841191","-3.68760088","Adjudicado",2019-05-29,"1",,,,"Aa-15/19",2019-05-31,,"Climatización de Ambientes Técnicos, SL","NIF","B84557297",,"24474","29613,54"
"3407052","https://contrataciondelestado.es/wps/poc?uri=deeplink:detalle_licitacion&idEvl=nhpfmpafNtWXQV0WE7lYPw%3D%3D",2019-06-03 16:20:25,"VIGENTE",2019-04-03,"Resuelta","A-13/19","Servicio para la adecuación del modelo al requerimiento aprobado en la 12ª convocatoria del Programa DOCENTIA-UAM por Consejo de Gobierno de 8 de febrero de 2019",,"82644,9","49586,94","60000,19","79419000;","1","79419000","Servicios de consultoría en evaluación",,,,,,,,,,,,,,,,,,,,,,,,,,,,,,,,,,,,,,,"Servicios",,"ES300 - Madrid","Madrid","40.40841191","-3.68760088","Rectorado de la Universidad Autónoma de Madrid",,"Q2818013A","U02300001",,"Organismo de Derecho público","28049","Abierto",,"Ordinaria","Electrónica",2019-04-23 15:00:00,,,,,,,,,"Sin lotes","Servicio para la adecuación del modelo al requerimiento aprobado en la 12ª convocatoria del Programa DOCENTIA-UAM por Consejo de Gobierno de 8 de febrero de 2019","82644,9","60000,19","49586,94","79419000;","1","79419000","Servicios de consultoría en evaluación",,,,,,,,,,,,,,,,,,,,,,,,,,,,,,,,,,,,,,,"ES300 - Madrid","Madrid","40.40841191","-3.68760088","Adjudicado",2019-05-24,"1",,,,"A-13/19",2019-05-28,2019-06-01,"Zener Soft Consulting S.L.","NIF","B86061249",,"45329,52","54848,72"
"3497987","https://contrataciondelestado.es/wps/poc?uri=deeplink:detalle_licitacion&idEvl=2%2B1mnEQxpVVvYnTkQN0%2FZA%3D%3D",2019-05-27 14:45:17,"VIGENTE",2019-04-24,"Resuelta","Sa-11/19","Suministro e instalación de una (1) vitrina de gases y montaje e instalación de una (1) vitrina extractora de gases (ya adquirida), en el módulo 4 de la Facultad de Ciencias de la Universidad Autónoma de Madrid
",,"21400","25894","25894","39180000;","1","39180000","Mobiliario de laboratorio",,,,,,,,,,,,,,,,,,,,,,,,,,,,,,,,,,,,,,,"Suministros",,"ES300 - Madrid","Madrid","40.40841191","-3.68760088","Rectorado de la Universidad Autónoma de Madrid",,"Q2818013A","U02300001",,"Organismo de Derecho público","28049","Abierto simplificado",,"Ordinaria","Electrónica",2019-05-10 15:00:00,,,,,,,,,"Sin lotes","Suministro e instalación de una (1) vitrina de gases y montaje e instalación de una (1) vitrina extractora de gases (ya adquirida), en el módulo 4 de la Facultad de Ciencias de la Universidad Autónoma de Madrid
","21400","25894","25894","39180000;","1","39180000","Mobiliario de laboratorio",,,,,,,,,,,,,,,,,,,,,,,,,,,,,,,,,,,,,,,"ES300 - Madrid","Madrid","40.40841191","-3.68760088","Adjudicado",2019-05-22,"1",,,,"Sa-11/19",2019-05-23,2019-05-23,"ROMERO MUEBLES DE LABORATORIO S.A.","NIF","A28476547",,"20340","24611,4"
"3424300","https://contrataciondelestado.es/wps/poc?uri=deeplink:detalle_licitacion&idEvl=AfYngEtt8P9vYnTkQN0%2FZA%3D%3D",2019-05-27 14:41:45,"VIGENTE",2019-04-08,"Resuelta","Sa-10/19","Suministro e instalación de equipamiento en el laboratorio 301 del módulo 16 de la Facultad de Ciencias",,"33057,85","33057,85","40000","39180000;","1","39180000","Mobiliario de laboratorio",,,,,,,,,,,,,,,,,,,,,,,,,,,,,,,,,,,,,,,"Suministros",,"ES300 - Madrid","Madrid","40.40841191","-3.68760088","Rectorado de la Universidad Autónoma de Madrid",,"Q2818013A","U02300001",,"Organismo de Derecho público","28049","Abierto simplificado",,"Ordinaria","Electrónica",2019-04-24 15:00:00,,,,,,,,,"Sin lotes","Suministro e instalación de equipamiento en el laboratorio 301 del módulo 16 de la Facultad de Ciencias","33057,85","40000","33057,85","39180000;","1","39180000","Mobiliario de laboratorio",,,,,,,,,,,,,,,,,,,,,,,,,,,,,,,,,,,,,,,"ES300 - Madrid","Madrid","40.40841191","-3.68760088","Adjudicado",2019-05-22,"3",,,,"Sa-10/19",2019-05-23,2019-05-24,"ROMERO MUEBLES DE LABORATORIO S.A.","NIF","A28476547",,"29566","35774,86"
"3431322","https://contrataciondelestado.es/wps/poc?uri=deeplink:detalle_licitacion&idEvl=Q3Nr8aSdaJIuf4aBO%2BvQlQ%3D%3D",2019-05-07 11:52:58,"VIGENTE",2019-04-09,"Resuelta","Aa-14/19","Mantenimiento de los sistemas de control de accesos a las áreas seguras de Tecnologías de la Información de la Universidad Autónoma e Madrid, y el mantenimiento de los sistemas de intrusión, video vigilancia y detección de fugas de líquidos del Centro de Procesos de Datos (CPD) de Tecnologías de la Información de la Universidad Autónoma de Madrid",,"21420","16065","19438,65","35120000;","1","35120000","Sistemas y dispositivos de vigilancia y seguridad",,,,,,,,,,,,,,,,,,,,,,,,,,,,,,,,,,,,,,,"Servicios",,"ES300 - Madrid","Madrid","40.40841191","-3.68760088","Rectorado de la Universidad Autónoma de Madrid",,"Q2818013A","U02300001",,"Organismo de Derecho público","28049","Abierto simplificado",,"Ordinaria","Electrónica",2019-04-25 15:00:00,,,,,,,,,"Sin lotes","Mantenimiento de los sistemas de control de accesos a las áreas seguras de Tecnologías de la Información de la Universidad Autónoma e Madrid, y el mantenimiento de los sistemas de intrusión, video vigilancia y detección de fugas de líquidos del Centro de Procesos de Datos (CPD) de Tecnologías de la Información de la Universidad Autónoma de Madrid","21420","19438,65","16065","35120000;","1","35120000","Sistemas y dispositivos de vigilancia y seguridad",,,,,,,,,,,,,,,,,,,,,,,,,,,,,,,,,,,,,,,"ES300 - Madrid","Madrid","40.40841191","-3.68760088","Adjudicado",2019-05-03,"1",,,,"1",2019-05-06,,"SEGURIDAD Y SISTEMAS INFORMATICOS S.L.","NIF","B81096190",,"14350,34","17363,9"
"2879192","https://contrataciondelestado.es/wps/poc?uri=deeplink:detalle_licitacion&idEvl=L0FcN9DDj%2F2mq21uxhbaVQ%3D%3D",2019-05-06 14:22:35,"VIGENTE",2019-01-24,"Resuelta","O-1/19","Obras de reforma de la Central de Producción de frío para el servicio de refrigeración de la Biblioteca de Humanidades y de la Facultad de Derecho de la Universidad Autónoma de Madrid",,"339074,78","410280,49","410280,49","45331220;","1","45331220","Trabajos de instalación de aire acondicionado",,,,,,,,,,,,,,,,,,,,,,,,,,,,,,,,,,,,,,,"Obras",,"ES300 - Madrid","Madrid","40.40841191","-3.68760088","Rectorado de la Universidad Autónoma de Madrid",,"Q2818013A","U02300001",,"Organismo de Derecho público","28049","Abierto",,"Ordinaria","Electrónica",2019-02-19 15:00:00,,,,,,,,,"1","Equipo de refrigeración de la Biblioteca de Humanidades",,"123477,72","102047,7","45331220;","1","45331220","Trabajos de instalación de aire acondicionado",,,,,,,,,,,,,,,,,,,,,,,,,,,,,,,,,,,,,,,"ES300 - Madrid","Madrid","40.40841191","-3.68760088","Adjudicado",2019-04-12,"12",,,,"O-1/19 LOTE 1",2019-05-06,,"MAESSA TELECOMUNICACIONES, INGENIERÍA, INSTALACIONES Y SERVICIOS","NIF","A50851823",,"70415,86","85203,19"
"2879192","https://contrataciondelestado.es/wps/poc?uri=deeplink:detalle_licitacion&idEvl=L0FcN9DDj%2F2mq21uxhbaVQ%3D%3D",2019-05-06 14:22:35,"VIGENTE",2019-01-24,"Resuelta","O-1/19","Obras de reforma de la Central de Producción de frío para el servicio de refrigeración de la Biblioteca de Humanidades y de la Facultad de Derecho de la Universidad Autónoma de Madrid",,"339074,78","410280,49","410280,49","45331220;","1","45331220","Trabajos de instalación de aire acondicionado",,,,,,,,,,,,,,,,,,,,,,,,,,,,,,,,,,,,,,,"Obras",,"ES300 - Madrid","Madrid","40.40841191","-3.68760088","Rectorado de la Universidad Autónoma de Madrid",,"Q2818013A","U02300001",,"Organismo de Derecho público","28049","Abierto",,"Ordinaria","Electrónica",2019-02-19 15:00:00,,,,,,,,,"2","Equipo de refrigeración de la Facultad de Derecho",,"286802,77","237027,08","45331220;","1","45331220","Trabajos de instalación de aire acondicionado",,,,,,,,,,,,,,,,,,,,,,,,,,,,,,,,,,,,,,,"ES300 - Madrid","Madrid","40.40841191","-3.68760088","Adjudicado",2019-04-09,"11",,,,"O-1/19 LOTE 2",2019-04-29,,"TUBERIAS Y MONTAJES SSAN JOSE, S.L.","OTROS","B91087445",,"201218,83","243474,78"
"3303781","https://contrataciondelestado.es/wps/poc?uri=deeplink:detalle_licitacion&idEvl=avRZlKIF2zMBPRBxZ4nJ%2Fg%3D%3D",2019-05-06 09:52:35,"VIGENTE",2019-03-11,"Resuelta","S-8/19","Suministro e instalación de equipamiento en el Laboratorio 503 del Módulo I de la Facultad de Ciencias de la Universidad Autónoma de Madrid",,"53986,16","53986,16","65323,25","39180000;","1","39180000","Mobiliario de laboratorio",,,,,,,,,,,,,,,,,,,,,,,,,,,,,,,,,,,,,,,"Suministros",,"ES300 - Madrid","Madrid","40.40841191","-3.68760088","Rectorado de la Universidad Autónoma de Madrid",,"Q2818013A","U02300001",,"Organismo de Derecho público","28049","Abierto",,"Ordinaria","Electrónica",2019-03-26 15:00:00,,,,,,,,,"Sin lotes","Suministro e instalación de equipamiento en el Laboratorio 503 del Módulo I de la Facultad de Ciencias de la Universidad Autónoma de Madrid","53986,16","65323,25","53986,16","39180000;","1","39180000","Mobiliario de laboratorio",,,,,,,,,,,,,,,,,,,,,,,,,,,,,,,,,,,,,,,"ES300 - Madrid","Madrid","40.40841191","-3.68760088","Adjudicado",2019-04-12,"1",,,,"S-8/19",2019-04-29,2019-04-29,"Köttermann Systemlabor, S.A.","NIF","A81429052",,"49897,52","60376"
"2913437","https://contrataciondelestado.es/wps/poc?uri=deeplink:detalle_licitacion&idEvl=fjsURCHfhKemq21uxhbaVQ%3D%3D",2019-04-12 14:37:12,"VIGENTE",2019-02-01,"Resuelta","S-6/19","Arrendamiento con opción de compra, sobre una parte o la totalidad de los equipos del lote 2, de diversos equipos informáticos para la Universidad Autónoma de Madrid",,"157087,35","157087,35","190075,69","30200000;","1","30200000","Equipo y material informático",,,,,,,,,,,,,,,,,,,,,,,,,,,,,,,,,,,,,,,"Suministros",,"ES300 - Madrid","Madrid","40.40841191","-3.68760088","Rectorado de la Universidad Autónoma de Madrid",,"Q2818013A","U02300001",,"Organismo de Derecho público","28049","Abierto",,"Ordinaria","Electrónica",2019-02-22 15:00:00,,,,,,,,,"1","Trescientos (300) ordenadores personales portátiles destinados al préstamo de estudiantes realizado en Biblioteca",,"165800,25","137025","30200000;","1","30200000","Equipo y material informático",,,,,,,,,,,,,,,,,,,,,,,,,,,,,,,,,,,,,,,"ES300 - Madrid","Madrid","40.40841191","-3.68760088","Adjudicado",2019-04-04,"2",,,,"S-6/19 Lote 1",2019-04-10,2019-04-11,"Desarrollo, Asesoría y Formación Informática, S.A. (DAYFISA)","NIF","A79135414",,"111624","135065,04"
"2913437","https://contrataciondelestado.es/wps/poc?uri=deeplink:detalle_licitacion&idEvl=fjsURCHfhKemq21uxhbaVQ%3D%3D",2019-04-12 14:37:12,"VIGENTE",2019-02-01,"Resuelta","S-6/19","Arrendamiento con opción de compra, sobre una parte o la totalidad de los equipos del lote 2, de diversos equipos informáticos para la Universidad Autónoma de Madrid",,"157087,35","157087,35","190075,69","30200000;","1","30200000","Equipo y material informático",,,,,,,,,,,,,,,,,,,,,,,,,,,,,,,,,,,,,,,"Suministros",,"ES300 - Madrid","Madrid","40.40841191","-3.68760088","Rectorado de la Universidad Autónoma de Madrid",,"Q2818013A","U02300001",,"Organismo de Derecho público","28049","Abierto",,"Ordinaria","Electrónica",2019-02-22 15:00:00,,,,,,,,,"2","Treinta y tres (33) ordenadores personales Desktop, destinados a Laboratorios de Música",,"24275,44","20062,35","30200000;","1","30200000","Equipo y material informático",,,,,,,,,,,,,,,,,,,,,,,,,,,,,,,,,,,,,,,"ES300 - Madrid","Madrid","40.40841191","-3.68760088","Adjudicado",2019-04-01,"2",,,,"S-6/19 Lote 2",2019-04-02,2019-04-03,"DISINFOR,S.L.","NIF","B78949799",,"18976,82","22961,95"
"3418840","https://contrataciondelestado.es/wps/poc?uri=deeplink:detalle_licitacion&idEvl=94KXIhx87AtvYnTkQN0%2FZA%3D%3D",2019-04-09 10:53:29,"VIGENTE",2019-04-05,"Resuelta","NSP-02/19","Suministro de licencias de software destinadas a docencia de diferentes asignaturas de grado, máster y prácticas en la Universidad Autónoma de Madrid: Licencias Matlab y Simulink Campus y 50 MathWorks Total Academic Headcount 50 Toolbox especificadas en el punto 2 del PPT. Adicionalmente MATLAB Academic Online Training Suite, cuyas características se especifican en el Pliego de Prescripciones Técnicas",,"20469,71","20469,71","24768,35","48000000;","1","48000000","Paquetes de software y sistemas de información",,,,,,,,,,,,,,,,,,,,,,,,,,,,,,,,,,,,,,,"Suministros",,"ES300 - Madrid","Madrid","40.40841191","-3.68760088","Rectorado de la Universidad Autónoma de Madrid",,"Q2818013A","U02300001",,"Organismo de Derecho público","28049","Negociado sin publicidad",,"Ordinaria","Electrónica",2019-04-05 15:00:00,,,,,,,,,"Sin lotes","Suministro de licencias de software destinadas a docencia de diferentes asignaturas de grado, máster y prácticas en la Universidad Autónoma de Madrid: Licencias Matlab y Simulink Campus y 50 MathWorks Total Academic Headcount 50 Toolbox especificadas en el punto 2 del PPT. Adicionalmente MATLAB Academic Online Training Suite, cuyas características se especifican en el Pliego de Prescripciones Técnicas","20469,71","24768,35","20469,71","48000000;","1","48000000","Paquetes de software y sistemas de información",,,,,,,,,,,,,,,,,,,,,,,,,,,,,,,,,,,,,,,"ES300 - Madrid","Madrid","40.40841191","-3.68760088","Adjudicado",2019-04-05,"1",,,,"NSP-02/19",2019-04-08,2019-04-09,"The MathWorks, S.L.","NIF","B62205745",,"19873,76","24047,25"
"3282597","https://contrataciondelestado.es/wps/poc?uri=deeplink:detalle_licitacion&idEvl=j9YnPwh%2F5y0uf4aBO%2BvQlQ%3D%3D",2019-03-13 11:13:49,"VIGENTE",2019-03-06,"Resuelta","NSP-01/19","Creación de una obra artística consistente en la realización de un retrato pictórico del ex rector D. José María Sanz Martínez",,"60000","60000","66000","92310000;","1","92310000","Servicios de creación e interpretación de obras artísticas y literarias",,,,,,,,,,,,,,,,,,,,,,,,,,,,,,,,,,,,,,,"Servicios",,"ES300 - Madrid","Madrid","40.40841191","-3.68760088","Rectorado de la Universidad Autónoma de Madrid",,"Q2818013A","U02300001",,"Organismo de Derecho público","28049","Negociado sin publicidad",,"Ordinaria","Electrónica",2019-02-22 15:00:00,,,,,,,,,"Sin lotes","Creación de una obra artística consistente en la realización de un retrato pictórico del ex rector D. José María Sanz Martínez","60000","66000","60000","92310000;","1","92310000","Servicios de creación e interpretación de obras artísticas y literarias",,,,,,,,,,,,,,,,,,,,,,,,,,,,,,,,,,,,,,,"ES300 - Madrid","Madrid","40.40841191","-3.68760088","Adjudicado",2019-03-05,"1",,,,"NSP-01/19",2019-03-07,2019-03-08,"HERNAN CORTES MORENO","NIF","31195445Q",,"60000","66000"
